age_band_id,cluster_rank,cluster_entity_id,cluster_label,selected_for_stage3,category_rank,category_entity_id,category_type_slug,category_label,priority_score,buyer_mode_label,primary_persona,gift_friendly,show_gift_action,gift_display_eligible,gift_confidence,common_ownership_risk,evidence_count,source_count,stage3_research_input_filename,stage3_ingestion_bundle_hint,reason_selected,manual_review_flag
age_19_21m,1,ent_cluster_19_21_words_pointing,I’m finding my words,true,1,cat_first_word_picture_books,cat_first_word_picture_books,First-word books to point at,49.1,Good gift,both,true,true,true,medium,high,6,5,ember_picks_19-21m_cat_first_word_picture_books.json,stage3_ingestion_bundle_19-21m.json,Top eligible in cluster; 6 evidence id(s); 5 source id(s); persona both; gift bonus 2.5; Good gift; has product family; high ownership risk (−),
age_19_21m,2,ent_cluster_19_21_pretend_copying,I’m copying everyday life,true,1,cat_doll_soft_toy_care,cat_doll_soft_toy_care,A doll or teddy to care for,48.95,Good gift,both,true,true,true,medium,high,6,4,ember_picks_19-21m_cat_doll_soft_toy_care.json,stage3_ingestion_bundle_19-21m.json,Top eligible in cluster; 6 evidence id(s); 4 source id(s); persona both; gift bonus 2.5; Good gift; has product family; high ownership risk (−),
age_19_21m,3,ent_cluster_19_21_busy_hands,My hands are busy now,true,1,cat_shape_sorters_puzzles,cat_shape_sorters_puzzles,Shape sorters and first puzzles,48.8,Good gift,both,true,true,true,medium,high,6,6,ember_picks_19-21m_cat_shape_sorters_puzzles.json,stage3_ingestion_bundle_19-21m.json,Top eligible in cluster; 6 evidence id(s); 6 source id(s); persona both; gift bonus 2.5; Good gift; has product family; high ownership risk (−),
age_19_21m,4,ent_cluster_19_21_move_climb,I’m moving with purpose,true,1,cat_soft_graspable_balls,cat_soft_graspable_balls,Soft balls to kick and chase,47.15,Good gift,both,true,true,true,medium,high,4,4,ember_picks_19-21m_cat_soft_graspable_balls.json,stage3_ingestion_bundle_19-21m.json,Top eligible in cluster; 4 evidence id(s); 4 source id(s); persona both; gift bonus 2.5; Good gift; has product family; high ownership risk (−),
age_19_21m,5,ent_cluster_19_21_pouring_feeding,I’m learning to feed myself,true,1,cat_pouring_jug_cups,cat_pouring_jug_cups,Pouring jugs and water cups,44.75,Parent buy,conor,false,false,false,,medium,5,3,ember_picks_19-21m_cat_pouring_jug_cups.json,stage3_ingestion_bundle_19-21m.json,Top eligible in cluster; 5 evidence id(s); 3 source id(s); Conor parent buy; Parent buy; has product family; medium ownership risk (−),
age_19_21m,6,ent_cluster_19_21_big_feelings,I’m having big feelings,true,1,cat_feelings_faces_books,cat_feelings_faces_books,Feelings and faces books,49.1,Good gift,both,true,true,true,medium,medium,5,4,ember_picks_19-21m_cat_feelings_faces_books.json,stage3_ingestion_bundle_19-21m.json,Top eligible in cluster; 5 evidence id(s); 4 source id(s); persona both; gift bonus 2.5; Good gift; has product family; medium ownership risk (−),
age_19_21m,7,ent_cluster_19_21_potty_bathroom,I’m noticing bathroom routines,true,2,cat_potty_books,cat_potty_books,Potty and bathroom books,43.2,Parent buy,conor,false,false,false,,high,6,4,ember_picks_19-21m_cat_potty_books.json,stage3_ingestion_bundle_19-21m.json,Top eligible in cluster; 6 evidence id(s); 4 source id(s); Conor parent buy; Parent buy; has product family; high ownership risk (−),
age_19_21m,8,ent_cluster_19_21_safer_home,Make exploring safer,true,1,cat_safety_gates,cat_safety_gates,Safety gates for stairs,42.8,Parent buy,conor,false,false,false,,medium,4,3,ember_picks_19-21m_cat_safety_gates.json,stage3_ingestion_bundle_19-21m.json,Top eligible in cluster; 4 evidence id(s); 3 source id(s); Conor parent buy; Parent buy; has product family; medium ownership risk (−),