age_band_id,cluster_rank,cluster_entity_id,cluster_label,selected_for_stage3,category_rank,category_entity_id,category_type_slug,category_label,priority_score,buyer_mode_label,primary_persona,gift_friendly,show_gift_action,gift_display_eligible,gift_confidence,common_ownership_risk,evidence_count,source_count,stage3_research_input_filename,stage3_ingestion_bundle_hint,reason_selected,manual_review_flag
age_6_9m,1,cluster_sitting_reaching,I’m sitting and reaching,true,2,cat_reach_grab_toys,cat_reach_grab_toys,Reach-and-grab toys,42.35,Good gift,both,true,true,true,high,medium,3,0,ember_picks_6-9m_cat_reach_grab_toys.json,stage3_ingestion_bundle_6-9m.json,Top eligible in cluster; 3 evidence id(s); persona both; gift bonus 3.5; Good gift; has product family; medium ownership risk (−),
age_6_9m,2,cluster_crawling_floor,I’m getting ready to move,true,1,cat_tummy_time_wobbler,cat_tummy_time_wobbler,Wobbly tummy-time toys,43.45,Good gift,both,true,true,true,medium,low,3,0,ember_picks_6-9m_cat_tummy_time_wobbler.json,stage3_ingestion_bundle_6-9m.json,Top eligible in cluster; 3 evidence id(s); persona both; gift bonus 2.5; Good gift; has product family,
age_6_9m,3,cluster_object_permanence,I’m finding hidden things,true,1,cat_peekaboo_scarf,cat_peekaboo_scarf,Peekaboo scarves,45.8,Good gift,both,true,true,true,medium,low,4,1,ember_picks_6-9m_cat_peekaboo_scarf.json,stage3_ingestion_bundle_6-9m.json,Top eligible in cluster; 4 evidence id(s); 1 source id(s); persona both; gift bonus 2.5; Good gift; has product family,
age_6_9m,4,cluster_stacking_containment,I’m putting things in and out,true,1,cat_stacking_nesting_cups,cat_stacking_nesting_cups,Stacking and nesting cups,43.4,Good gift,both,true,true,true,high,medium,3,0,ember_picks_6-9m_cat_stacking_nesting_cups.json,stage3_ingestion_bundle_6-9m.json,Top eligible in cluster; 3 evidence id(s); persona both; gift bonus 3.5; Good gift; has product family; medium ownership risk (−),
age_6_9m,5,cluster_mouth_sensory,I’m exploring with my mouth,true,1,cat_teethers,cat_teethers,Teethers and chew-safe toys,43.25,Good gift,both,true,true,true,high,medium,3,0,ember_picks_6-9m_cat_teethers.json,stage3_ingestion_bundle_6-9m.json,Top eligible in cluster; 3 evidence id(s); persona both; gift bonus 3.5; Good gift; has product family; medium ownership risk (−),
age_6_9m,6,cluster_first_foods,I’m trying first tastes,true,1,cat_highchair,cat_highchair,A supportive highchair,38.6,Parent buy,conor,false,false,false,,medium,3,0,ember_picks_6-9m_cat_highchair.json,stage3_ingestion_bundle_6-9m.json,Top eligible in cluster; 3 evidence id(s); Conor parent buy; Parent buy; has product family; medium ownership risk (−),
age_6_9m,7,cluster_home_safety,Keep little hands safer,true,1,cat_safety_gates,cat_safety_gates,Safety gates,37.7,Parent buy,conor,false,false,false,,low,2,0,ember_picks_6-9m_cat_safety_gates.json,stage3_ingestion_bundle_6-9m.json,Top eligible in cluster; 2 evidence id(s); Conor parent buy; Parent buy; has product family,
age_6_9m,8,cluster_books_sounds,I’m listening and joining in,true,1,cat_board_books,cat_board_books,Board books and face books,45.55,Good gift,both,true,true,true,high,high,4,2,ember_picks_6-9m_cat_board_books.json,stage3_ingestion_bundle_6-9m.json,Top eligible in cluster; 4 evidence id(s); 2 source id(s); persona both; gift bonus 3.5; Good gift; has product family; high ownership risk (−),