Age Band Prompt,age_band_label,min_months,max_months,age_band_is_active,stage1_wrapper_ux_slug,stage1_wrapper_ux_label,stage1_wrapper_rank_in_band,stage1_mapping_is_active,development_need_slug,development_need_canonical_name,stage1_why_it_matters_ux_description,stage2_category_type_slug,stage2_category_type_label,stage2_category_type_name,stage2_play_ideas_rank,stage2_play_idea_mapping_rationale,stage3_product_name,stage3_product_brand,stage3_product_rank_in_category,stage3_product_mapping_rationale,optional_need_meta_stage_anchor_month,optional_need_meta_stage_phase,optional_need_meta_stage_reason,optional_category_image_url,optional_category_safety_notes,ref_ux_wrapper_uuid,ref_development_need_uuid,ref_category_type_uuid,ref_product_uuid
13–15 months,13-15m,13,15,,,,,,,,,pricing_journey_free_discover,"$Image title: Low shelf play ideas by age for 13–15 months $Description: A small rotation of toys on a low shelf — chunky books, stacking cups and soft animals — makes it easy to browse what fits this age when you’ve got a minute.",,,,,,,,,,,,,,,
10–12 months,10-12m,10,12,,,,,,,,,pricing_journey_patch_walkers,"$Image title: Baby walker for first steps for 10–12 months $Description: A sturdy push-along baby walker can help when standing and early steps are just beginning. Useful nearby if a neighbour is passing one on at the right time.",,,,,,,,,,,,,,,
13–15 months,13-15m,13,15,,,,,,,,,pricing_journey_seasons_christmas,"$Image title: Christmas gift ideas for 13–15 months $Description: A short Christmas gift list for this age — board books, simple wooden toys and one or two wraps family can choose from — so relatives buy useful, not random.",,,,,,,,,,,,,,,
13–15 months,13-15m,13,15,,,,,,,,,pricing_journey_chapters_nursery,"$Image title: First day at nursery settle kit for 13–15 months $Description: A nursery bag with spare clothes, a comfort teddy and a familiar cup helps the settling weeks feel more ordinary when nursery is about to start.",,,,,,,,,,,,,,,
7–9 months,7-9m,7,9,,,,,,,,,pricing_journey_pass_on_white_noise,"$Image title: White noise machine ready to pass on for 7–9 months $Description: A white noise or sleep machine that has done its job can help another local baby settle. Pass it on when nights are quieter and cupboard space is worth more.",,,,,,,,,,,,,,,
